title,section,image_url,article_url,content_time,author_name,description
Gobierno advierte que el contrabando se convirtió en una amenaza a la seguridad del Estado,País,https://www.lostiempos.com/sites/default/files/styles/noticia_detalle/public/media_imagen/2024/5/19/huevo.jpg?itok=1IXXVL9g,https://www.lostiempos.com/actualidad/pais/20240519/gobierno-advierte-que-contrabando-se-convirtio-amenaza-seguridad-del-estado,Publicado el 19/05/2024 a las 11h27,ABI,"
El contrabando amenaza la seguridad del Estado por el daño económico, social e incluso a la salud debido al ingreso de medicamentos no autorizados y sin registro sanitario, advirtió el viceministro de Lucha Contra el Contrabando, Daniel Vargas.""El contrabando no solo es una actividad ilícita de ingresar o sacar mercadería, es una amenaza para la seguridad de los Estados en la parte económica, seguridad alimentaria y salud de la población, porque no sabemos qué tipo de medicamentos están ingresando"", explicó.La frontera de Bolivia con Chile es la más conflictiva, ya que ambos países comparten 861 kilómetros de frontera. Las características topográficas son aprovechadas por las organizaciones criminales dedicadas al contrabando, abriendo pasos ilegales.""La frontera más conflictiva que tenemos es con Chile por la gran cantidad de mercadería que ingresa. Tenemos vehículos indocumentados, (artefactos de) línea blanca y negra, y ropa usada. Los contrabandistas están organizados con sus elementos de choque, invierten una gran cantidad de dinero en la mercancía y no están dispuestos a perder"", afirmó.Desde finales de 2023 se identificaron alrededor de 105 pasos ilegales con Chile. Justamente en esta frontera fueron comisadas en esta semana armas de fuego de grueso calibre con capacidad, incluso, de penetrar vehículos blindados.También se comisaron motorizados con armamento; por lo que, es necesario contar con un nuevo ""manual del uso de la fuerza y armas de fuego"" contra el contrabando.""El contrabando está empleando armas de uso de las Fuerzas Armadas, por lo que se está analizando el uso de la fuerza y de las armas de fuego en esa línea"", precisó.""Clanes familiares"" operan en la zona, incluso contratan a terceras personas para internar productos de contrabando.Ante esta situación se reforzó el control en la región fronteriza con dos fuerzas de tarea conjunta.""Tenemos desplazado al Décimo Sexto Contingente que está hace más de 20 días en la lucha contra el contrabando en diferentes puntos fronterizos (...) tenemos dos fuerzas de tarea conjunta en la frontera con Chile, justamente por las características que tiene, por los más de 105 pasos ilegales que hemos identificado"", precisó.Desde el Gobierno nacional se plantearon siete propuestas a Chile para hacer frente a las organizaciones criminales que se dedican a este ilícito. Destacó el acercamiento con las autoridades del vecino país.""Hemos tenido dos reuniones en Cancillería con algunas autoridades (chilenas) en lo que es la lucha contra el contrabando, estamos trabajando en esas siete propuestas que hemos planteado"", puntualizó.Entre estas propuestas están: el intercambio de información de modus operandi, pasos ilegales; establecer canales de comunicación entre las aduanas; establecimiento de puntos focales, operativos conjuntos, entre otros.""Estamos en este proceso, y consideramos que en Chile se están realizando acciones más contundentes en lo que es la lucha contra el contrabando. Hemos visto que carabineros han detenido a contrabandistas, los han procesado, ya están adquiriendo esta conciencia y responsabilidad que tienen como Estado"", destacó."
Hermanos Dellien ya conocen a sus rivales del Roland Garros,Tenis,https://www.lostiempos.com/sites/default/files/styles/noticia_detalle/public/media_imagen/2024/5/14/herrmanos_dellien_-_fbt_0.jpg?itok=WkiWniWS,https://www.lostiempos.com/deportes/tenis/20240519/hermanos-dellien-ya-conocen-sus-rivales-del-roland-garros,Publicado el 19/05/2024 a las 9h19,AGENCIAS,"
Los hermanos Hugo y Murkel Dellien ya conocen a sus contrincantes por la primera ronda de la qualy (clasificación) del Roland Garros de Francia. El mayor se enfrentará al francés Benjamín Bonzi y el menor rivalizará con el brasileño Thiago Monteiro.
El Comité Organizador sorteó las llaves de la qualy con la presencia de 128 tenistas que lucharán por las 16 plazas que darán acceso a la llave central.
Esto significa que para acceder al cuadro principal cada tenista deberá superar tres partidos de la clasificación.
Entre ellos se encuentran los Dellien. Para Hugo será su séptima participación consecutiva, mientras que para Murkel será su debut absoluto no solo en este torneo, sino en un Grand Slam."
"Mbappé, fuera del último partido de Liga, le queda final de Copa para despedirse del PSG",Fútbol Int.,https://www.lostiempos.com/sites/default/files/styles/noticia_detalle/public/media_imagen/2023/12/14/15_dep_4_efe.jpg?itok=YgjZo6-G,https://www.lostiempos.com/deportes/futbol-int/20240519/mbappe-fuera-del-ultimo-partido-liga-le-queda-final-copa-despedirse-del,Publicado el 19/05/2024 a las 9h09,EFE,"
El delantero del PSG Kylian Mbappé no ha sido convocado para el choque de este domingo ante el Metz, de la última jornada de Liga, por lo que solo le queda la final de Copa del 25 de mayo ante el Lyon como última posibilidad para vestir los colores parisinos, antes de que se marche del club este junio.
La lista que distribuyó el entrenador del PSG, el español Luis Enrique, deja fuera a otras figuras como Marquinhos, Ousmane Dembélé, Vitinha, Fabian Ruiz y Gianluigi Donnarumma.
El PSG, eliminado en las semifinales de Champions ante el Borussia, ya ganó el campeonato hace varias jornadas y levantó también la Supercopa. Si logra ante el Lyon la Copa de Francia, lograría el triplete.
Fichado en 2017 procedente del Mónaco a cambio de 180 millones de euros, Mbappé abandonará el Parque de los Príncipes como máximo goleador histórico del PSG, con 256 dianas, y como mejor artillero de la Liga francesa en seis ocasiones (2019, 2020, 2021, 2022, 2023 y 2024), lo nunca visto en el campeonato local.
Tras ganar el Mundial con Francia en 2018 y todos los títulos locales, al genio de Bondy solo se le ha resistido en París la Champions, que rozó en 2020, cuando cayó en la final ante el Bayern de Múnich.
Después de estar cerca de marcharse al Real Madrid, sobre todo en el verano de 2021, el delantero anunció en febrero que no renovaba su contrato este junio, aunque no desveló cuál será su próximo destino.
"
GV San José rescata un empate sobre el final ante Independiente,Fútbol,https://www.lostiempos.com/sites/default/files/styles/noticia_detalle/public/media_imagen/2024/5/19/23_dep5_apg.jpg?itok=w3yNyYaw,https://www.lostiempos.com/deportes/futbol/20240519/gv-san-jose-rescata-empate-final-independiente,Publicado el 19/05/2024 a las 5h49,,"
Con un gol de Rodrigo Vargas a los 46’ST y con un hombre menos desde los 9’ST, GV San José rescató un empatepor 2-2  frente a Independiente, en el partido por la fecha 2 del Campeonato Clausura, que se disputó en el estadio Jesús Bermúdez.
GV San José tuvo que arrancar desde atrás para cambiar el marcador, que era favorable para Independiente por 0-2, con un doblete de Francisco Gatti convertidos a los 18’PT y 33’PT.
Gatti convirtió el 0-1 con un golpe de cabeza tras un centro de Jonatan Cristaldo y volvió a conectar un centro enviado por Cristaldo para el 0-2.
El descuento llegó sobre el final del primer tiempo (46’PT), por intermedio de Brian Sobrero con un taquito que se coló al fondo de las redes.
GV San José se quedó con 10 hombres tras la expulsión de Raúl Gómez (9’ST).
El empate llegó tras un centro de Javier Sanguinetti cabeceado por Andrés Landa, asistiendo para que Vargas anote el 2-2 final."
Muñoz gana el torneo Chuquiago Open  de Tenis en La Paz,Tenis,https://www.lostiempos.com/sites/default/files/styles/noticia_detalle/public/media_imagen/2024/5/19/23_dep3_apg.jpg?itok=HSsqRAmP,https://www.lostiempos.com/deportes/tenis/20240519/munoz-gana-torneo-chuquiago-open-tenis-paz,Publicado el 19/05/2024 a las 5h43,,"
Diego Muñoz ayer conquistó la final boliviana que tuvo el Chuquiago Open, tras que venció por 2-1 (6-1, 3-6 y 6-2) a Santiago Lora y así quedarse con el título de la categoría 18 años.
En su último año en esta categoría, Muñoz salió campeón en un partido apretado. Mientras que, Lora con 16 años, dio la sorpresa  con su rendimiento.
En damas, la argentina Sol Larraya hizo prevalecer su condición de favorita ganando la final sobre la brasileño Gabriela Félix Da Silva por 2-0, por un doble 6-3, aprovechando los descuidos de su rival en los primeros puntos de cada período."
Grecia Cristódulo hizo historia en el Mundial de BMX,Multideportivo,https://www.lostiempos.com/sites/default/files/styles/noticia_detalle/public/media_imagen/2024/5/19/23_dep2_fbb.jpg?itok=wHbDDZJW,https://www.lostiempos.com/deportes/multideportivo/20240519/grecia-cristodulo-hizo-historia-mundial-bmx,Publicado el 19/05/2024 a las 5h39,Redacción Central,"
La ciclista nacional Grecia Cristódulo ayer hizo historia para el bicicross boliviano, después que logró meterse en la final de la categoría Junior en el Mundial de BMX, que se disputa en Estados Unidos.
Cristódulo, en la final, acabó en el octavo puesto, después que en la última curva sufrió una caída, cuando peleaba por los primeros puestos.
La paceña Anna Sarah Rojas, que vive en Suiza, fue la piloto junior que más lejos llegó en la semifinal del Mundial de Amsterdam el 2013. Once años después Cristódulo mejoró ese rendimiento."
Nacional Potosí hizo respetar su reducto tras vencer a Real Santa Cruz,Fútbol,https://www.lostiempos.com/sites/default/files/styles/noticia_detalle/public/media_imagen/2024/5/19/23_dep4_apg.jpg?itok=kE-QtfVM,https://www.lostiempos.com/deportes/futbol/20240519/nacional-potosi-hizo-respetar-su-reducto-vencer-real-santa-cruz,Publicado el 19/05/2024 a las 5h31,,"
Sin Samuel Galindo para tomar el eje del equipo en el segundo tiempo tras su expulsión (46’ST), Nacional Potosí logró un triunfo ajustado sobre Real Santa Cruz por 1-0, ayer en el estadio Víctor Agustín Ugarte, en el partido por la segunda fecha del Campeonato Clausura.
La ausencia de Galindo, expulsado por doble amonestación, se sintió en el complemento, período en el cual Nacional Potosí tuvo que trabajar el doble en la marcación para evitar que Real Santa Cruz se desborde hacia la conquista del empate.
Antes de la expulsión de Galindo, a los 28’PT, Miyhel Ortiz anotó el 1-0, conectado de primera con la zurda un centro que envió Javier Guerra desde el costado derecho. Pese a la marcación que tenía el lateral, pudo darle dirección al disparo para vencer al arquero Diego Zamora.
Nacional fue distinto con y sin Galindo en la mitad del campo. El mediocampista se encargaba de repartir los balones, permitiendo llegar a línea de fondo y entregar la pelota a Martín Prost, quien tuvo dos chances para anotar."
"La U de Vinto vuelve con las manos vacías, cae ante Oriente",Fútbol,https://www.lostiempos.com/sites/default/files/styles/noticia_detalle/public/media_imagen/2024/5/19/23_dep1_apg.jpg?itok=bCj3OE8g,https://www.lostiempos.com/deportes/futbol/20240519/vinto-vuelve-manos-vacias-cae-oriente,Publicado el 19/05/2024 a las 5h19,Redacción Central,"
Universitario de Vinto no pudo sumar ayer en su visita a Oriente Petrolero, que ganó, por 2-1, el partido que correspondió a la segunda fecha del Campeonato Clausura y que se jugó en el estadio Ramón Aguilera Costas.
Con este resultado el cuadro cochabambino, que ya es Bolivia 1 a la Copa Sudamericana 2025 por ser el subcampeón del Torneo Apertura, se ubica de momento fuera de la zona de premiación a la Copa Libertadores, en la tabla acumulada.
Entre tanto, para Oriente Petrolero estos tres puntos le permiten alejarse de la zona del descenso, ya que en la tabla acumulada ahora se ubica en el puesto noveno.
Partido
Oriente Petrolero tuvo las acciones más claras en el primer tiempo, donde el golero Gustavo Almada evitó la caída de su pórtico en más de una oportunidad.
Por ejemplo, a los 4’PT Almada detuvo de primera el remate de Fabian Barreto, que rebotó en Diago Giménez.
Pasaron más de 30 minutos para la primera jugada de riesgo de la U de Vinto, con un disparo de Maximiliano Núñez (33’PT) que rechazó con los puños el golero Rubén Cordano.
En el segundo tiempo Oriente Petrolero finalmente abrió el marcador con el gol de Gilbert Álvarez (10’ST).
La jugada inició con un cabezazo de Carlos Ventura, que Almada intentó despejar, pero en el rebote el balón terminó en los pies de Dieguito Rodríguez, quien hizo un pase retrasado para Álvarez, que venció a Almada con un potente disparo.
Once minutos (21’ST) después Marcos Riquelme amplió el marcador con un potente derechazo, tras la habilitación de Álvarez.
A los 32’ST Riquelme no pudo darle dirección a su toque y se perdió el tercero.
En los minutos finales del duelo Universitario de Vinto logró el descuento con el tanto de Juan Cuéllar, quien convirtió el 2-1, con un potente disparo desde la media luna, que primero chocó contra Junior Sánchez, para colarse en el fondo del arco."
"El origen y nacimiento del fútbol  en el mundo, Sudamérica y Bolivia",Fútbol,https://www.lostiempos.com/sites/default/files/styles/noticia_detalle/public/media_imagen/2024/5/19/esp_dep_gabriel_1_legendsfootball.jpg?itok=diJSB1es,https://www.lostiempos.com/deportes/futbol/20240519/origen-nacimiento-del-futbol-mundo-sudamerica-bolivia,Publicado el 19/05/2024 a las 4h58,Gabriel Caero Rodríguez,"
El fútbol en el mundo se originó, según historiadores, en épocas antiguas y se cree que tuvo su nacimiento en las poblaciones del mar mediterráneo, Grecia y América. Lo cierto es que, a finales del siglo XIX, comenzó a popularizarse en Inglaterra, la génesis del balompié que, en 1857, dio vida al primer club de fútbol del planeta.
Al ser un deporte altamente popular, el fútbol se extendió por todos los rincones del  globo terráqueo. Bolivia fue uno de los primeros países que adoptó esta disciplina, a finales de 1800.
Inglaterra exporta fútbol
Deporte popular en Inglaterra y con fuerte impulso en las escuelas, el balompié comenzó a ganar notoriedad. Alrededor de 1856, comenzaron a establecerse sus principales reglas.
Con el nacimiento del club Sheffield United en Inglaterra (1857), otras instituciones comenzaron a fundarse y poco a poco esta disciplina deportiva creció.
Los trabajadores británicos del ferrocarril, a inicios de 1870, “exportaron” el fútbol a Sudamérica, teniendo su epicentro en Argentina, donde hoy están los nueve clubes más antiguos del continente.
Nace el Decano en Oruro
A Bolivia llegó de la misma manera, gracias a la creación de la empresa de ferrocarriles Bolivian Railway y los trabajadores bolivianos que conocieron este deporte en las salitreras chilenas. En Oruro, el histórico Oruro Royal nació un 26 de mayo de 1896, siendo hoy el principal vestigio de este importante hito histórico hasta nuestros días.
“La primera época se inicia con la fundación de la institución, el 26 de mayo de ese año, en la que comienzan los espectáculos en Oruro, cuna del deporte nacional. La segunda, cuando el fútbol había logrado difundirse a través del entusiasmo que despertó en la población, se inician las giras del Oruro Royal. La tercera, quizá la más importante, se da vida a otras especialidades deportivas fundadas, como las asociaciones y sociedades. El Royal participa de inolvidables jornadas dominicales, en las que exhibe fútbol con excelente dominio de la pelota, elegante, fuerte, con mucho civismo, amor a la tierra y el país”, relata Eddy Ronald Paravicini Ramoso, en su libro “Génesis del deporte boliviano 1896”.
Un año después nació Stormers San Lorenzo en Potosí (26 de mayo de 1897), club que ahora representa a Llallagua. A la fecha, en Bolivia hay 21 clubes que sobrepasan los 100 años de vida."
Aurora enfrentará a Guabirá con la misma idea de juego,Fútbol,https://www.lostiempos.com/sites/default/files/styles/noticia_detalle/public/media_imagen/2024/5/19/21_dep5_jamesss.jpg?itok=95h2CMHu,https://www.lostiempos.com/deportes/futbol/20240519/aurora-enfrentara-guabira-misma-idea-juego,Publicado el 19/05/2024 a las 4h38,Betty Rojas Rodríguez ,"
Aurora visitará a Guabirá hoy (15:00) en el partido por la segunda fecha del Campeonato Clausura, que se disputará en el estadio Gilberto Parada.
El Equipo del Pueblo llega a este encuentro tras remontar y vencer (3-1) a Oriente Petrolero, en la primera fecha y esta tarde espera sumar sus primeros puntos en condición de visitante.
Con ese objetivo en la mira el estratega de Aurora, Sergio Órteman, presentará la misma idea de juego con la que derrotó a Oriente.
Para este encuentro el técnico aún no puede contar con el juvenil Carlos Sejas, quien en la semana aún trabajó de manera diferenciada.
Quien ya está a disposición es el otro juvenil Ariel Flores, quien está recuperado y fue considerado para ser parte de la delegación que viajó a Santa Cruz.
Entre tanto, Guabirá llega a este encuentro tras la dura caída (3-2) que sufrió ante San Antonio, en Entre Ríos, después que ganaba por 0-1.
El plantel azucarero espera sumar sus primeras unidades esta tarde, para así dejar lejos la zona del descenso de categoría y empezar a pelear por un premio internacional."
Wilster quiere seguir en la senda del triunfo a costa de Strongest,Fútbol,https://www.lostiempos.com/sites/default/files/styles/noticia_detalle/public/media_imagen/2024/5/19/21_dep4_lopezzzz.jpg?itok=0DubNJqS,https://www.lostiempos.com/deportes/futbol/20240519/wilster-quiere-seguir-senda-del-triunfo-costa-strongest,Publicado el 19/05/2024 a las 4h20,Betty Rojas Rodríguez ,"
Wilstermann buscará sumar su segunda victoria al hilo en el Campeonato Clausura cuando hoy desde las 19:30 enfrente a The Strongest, en el partido por la fecha 2, que se jugará en el estadio Félix Capriles.
El Aviador llega a este partido con los ánimos elevados tras la victoria (0-2) a domicilio ante Real Santa Cruz,en la primera fecha.
Los dirigidos por Gastón Ramondino buscarán sumar los tres puntos que les permita empezar a alejarse de la zona de descenso.
Para este duelo Ramondino no podrá contar con el volante Sergio Adrián y el defensa Martín Chiatti que están proceso de recuperación de diferentes afecciones.
En contrapartida ya tiene a disposición al defensa Santiago Echeverría, quien cumplió su partido de suspensión por expulsión del Torneo Clausura 2023 y también podrá contar con Jefferson Tavares, recuperado de un edema en el aductor.
También está adisposición el delantero Ariel Nahuelpán, pese a que este intimó al club por el pago de más de 90mil dólares.
Entre tanto,The Strongest, debutó con triunfo en el Clausura al vencer (2-1) a Nacional Potosí y el miércoles logró su clasificación a los octavos de final de la Copa Libertadores, después de golear por 4-0 a Huachipato.

Otro duelo
Bolívar recibirá a Real Tomayapo en el estadio Hernando Siles, desde las 17:30, en el partido por la segunda fecha del Clausura.
La Academia buscará subir a la cima de la tabla de posiciones."
Victoria gana el Nacional de Aguas Abiertas,Multideportivo,https://www.lostiempos.com/sites/default/files/styles/noticia_detalle/public/media_imagen/2024/5/19/21_dep1_jamessss.jpg?itok=rsZ76COw,https://www.lostiempos.com/deportes/multideportivo/20240519/victoria-gana-nacional-aguas-abiertas,Publicado el 19/05/2024 a las 3h41,Betty Rojas Rodríguez ,"
El club cochabambino Victoria ganó la tercera fecha del Circuito Nacional Interclubes de Aguas Abiertas, que se desarrolló ayer en la represa de La Angostura, en Cochabamba.
Victoria sumó un total de 98 puntos para ubicarse en la cima de la tabla. El segundo lugar fue para el club capitalino Náutico (82) y el cruceño Sportmotion completó el podio con 36 puntos.
Este campeonato revistió de importancia, ya que base a los resultados obtenidos se definirán las selecciones na- cionales para la Copa Pacífico que, se disputará en Ecuador del 7 al 10 de agosto y el Mundial Juvenil de Aguas Abiertas que, se realizará en Italia, del 6 al 8 de septiembre.
El presidente de la Federación Boliviana de Natación (Febona), Pedro Cervantes, aseguró que mañana se conocerá la nómina de ambas selecciones.
“Se va a evaluar los tiempos obtenidos por cada uno de los nadadores. El lunes vamos a tener la lista oficial de todos los seleccionados que cumplan con los requisitos exigidos. Estamos hablando de entre 12 a 14 nadadores que van a ser parte del Equipo Bolivia para estos dos eventos internacionales”, dijo Cervantes.
Los ganadores
Sofía Morales y Rafael Salvatierra conquistaron el primer lugar en la prueba de 500 metros, para las edades de 8-9 años.
En la distancia de 1.25 Km los vencedores fueron: en 10-11 años Aroa Heredia e Ian Singuri, en 12-13 años Keyla Díaz y Matías Ríos, en 14-15 años Sofía Sejas y Juan Uriona, en los 16-17 años Vania Vaca y Leandro Yucra, en 18-19 años Carla Ordóñez, en 20-24 años Beatriz Morales y Patricio Vargas,

en 25-34 años Ana Aramayo y Sergio Antezana, en 35-44 años Pamela Carrasco y Juan Camacho, en 45-54 años Wendy Landa y Joy Crespo.
En la distancia de 2.5 Km los ganadores fueron: en 14-15 años Melisa Gonzales y Matías Mérida, en 16-17 años Priscila Guzmán y Daniel Ponce, en 18-19 años Jaqueline Quisbert y Erland Amurrio, en 20-24 años Alexander Quintanilla, en 25-34 años Keyla Acuña y Ever Mamani, en 35-44 años
Inés Baina y Sergio Villarroel, en 45-54 años cielo Estrada y Juan Carvalho, en 65-74 años Erick Arancibia.
En los 5 kilómetros los campeones nacionales fueron: en 14-15 años Carolina Quiroga y Rafael Arispe, en 16-17 años María Rodríguez y David Calderón, en 18-19 años Valeria Figueroa y Alejandro Plaza, en 20 años mayores Estela Durán y Wilder Carreño.
En los 10 Km en 20 años los vencedores fueron: Isabel Heredia y Percy Escobar.
La próxima cita para los nadadores de aguas abiertas a nivel nacional será el Desafío de Altura de Misicuni, que se realizará en la represa de Misicuni, el próximo domingo 26 de mayo."
